{
  "version": 1,
  "slug": "legal-discovery-intelligence-graph",
  "title": "Legal Discovery Intelligence Graph",
  "summary": "A deployed Graph RAG investigation workspace with cited evidence, entity graphs, and reproducible evaluation.",
  "outcome": "A live investigation workspace combining graph and vector retrieval with cited evidence.",
  "industries": ["Legal technology"],
  "categories": ["AI/ML", "Analytics", "Data Engineering"],
  "stack": ["Python", "Streamlit", "LangChain", "sentence-transformers", "PostgreSQL + pgvector", "Neo4j AuraDB", "Supabase", "Plotly"],
  "githubUrl": "https://github.com/vaibhavkhuranaaa/legal-discovery-intelligence-graph",
  "liveUrl": "https://legal-discovery-intelligence-graph-ma2dfvnresf84ytk4nzelm.streamlit.app/",
  "deployment": {"provider": "Streamlit Community Cloud", "status": "live", "runtime": "Streamlit"},
  "metrics": ["Entity extraction F1 0.889 strict", "Graph retrieval R@5 0.929", "Graph relationship hit@5 0.833"],
  "stages": ["Synthetic corpus generation", "Entity and event extraction", "Vector indexing", "Graph loading", "Hybrid retrieval", "Streamlit delivery"],
  "architecture": ["Discovery corpus", "Extraction", "pgvector retrieval", "Neo4j graph", "Evidence orchestration", "Investigation dashboard"],
  "evaluation": ["Entity extraction strict F1 is 0.889.", "Graph retrieval R@5 is 0.929 and relationship hit@5 is 0.833."],
  "operationalTradeoffs": ["The reproducible corpus is synthetic, so results are not claims about real legal matters.", "Graph and vector systems are retained together to support complementary retrieval paths."],
  "disclaimer": "All documents, people, companies, amounts, and events are synthetic and fictional. The displayed results are reproducible evaluation results on a templated corpus."
}
