{
  "version": 1,
  "slug": "legal-document-intelligence-rag",
  "title": "Legal Document Intelligence RAG",
  "summary": "Citation-grounded answers over public Delaware M&A litigation, built end-to-end on Azure.",
  "outcome": "A citation-required research workflow over a controlled public legal corpus.",
  "industries": ["Legal technology"],
  "categories": ["AI/ML", "Cloud"],
  "stack": ["Python", "Azure Document Intelligence", "Azure OpenAI", "Azure AI Search", "Azure Blob Storage", "Streamlit"],
  "githubUrl": "https://github.com/vaibhavkhuranaaa/legal-document-intelligence-rag",
  "liveUrl": null,
  "deployment": {"provider": "Azure", "status": "release-pending", "runtime": "Azure App Service"},
  "metrics": ["139 deterministic tests", "390 approved public chunks", "Citation-required grounded generation"],
  "stages": ["Public PDF ingestion", "Structure-aware chunking", "Hybrid retrieval", "Grounded generation", "Streamlit delivery", "Azure deployment"],
  "architecture": ["PDF corpus", "Azure Document Intelligence", "Structured chunks", "Azure AI Search", "Azure OpenAI", "Cited response"],
  "evaluation": ["Deterministic tests cover ingestion, retrieval, and answer-grounding behavior.", "Responses require source citations from approved public chunks."],
  "operationalTradeoffs": ["The public App Service release remains pending recovery and smoke testing.", "The corpus is intentionally limited to approved public opinions."],
  "disclaimer": "Uses public court opinions only. Legal information, not legal advice. The public App Service release is pending recovery and smoke testing."
}
